{"$id":"https://raw.githubusercontent.com/GeorgiiMakarov/LIGHTWEIGHT-XR-CONTENT-ENGINE/main/schemas/template-pack.schema.json","$schema":"http://json-schema.org/draft-07/schema#","additionalProperties":false,"description":"Mirror of character-pack.schema.json from the advertiser side. A template pack is a creative plus a binding contract: it declares WHERE the user's character may be composed (slots), WHAT the composer is allowed to do (binding rules), what renders without consent (fallback), and what counts as a verified impression. Raw faces never enter this contract — only character-pack references. v1.1.0: two-axis consent, consent classes, instance TTL, age gate, placement mode, personalization level.","properties":{"age_gate":{"additionalProperties":false,"description":"Kids safety: personalization is deny-by-default for minors.","properties":{"minors_allowed":{"default":false,"type":"boolean"},"require_age_attestation":{"description":"When true, the runtime must have an age attestation before composing any personalization.","type":"boolean"}},"required":["minors_allowed","require_age_attestation"],"type":"object"},"campaign":{"additionalProperties":false,"properties":{"campaign_id":{"minLength":1,"type":"string"},"locales":{"items":{"pattern":"^[a-z]{2}(-[A-Z]{2})?$","type":"string"},"minItems":1,"type":"array"},"max_impressions_per_user":{"default":3,"description":"Frequency cap on ALL serves (personalized or fallback). Survival condition for the format.","minimum":1,"type":"integer"},"max_personalized_impressions_per_user":{"description":"Brand safety both ways: after N personalized serves, further serves use fallback.","minimum":1,"type":"integer"},"window_end":{"format":"date-time","type":"string"},"window_start":{"format":"date-time","type":"string"}},"required":["campaign_id","window_start","window_end"],"type":"object"},"character_requirements":{"additionalProperties":false,"properties":{"min_assets":{"description":"Asset kinds the composer needs from the user's character pack.","items":{"enum":["image","glb_bundle","expression_clip"]},"type":"array"},"require_original_design":{"default":true,"description":"User character pack must attest character.original_design = true.","type":"boolean"}},"type":"object"},"compose":{"additionalProperties":false,"description":"On-device composer policy. The composed instance is ephemeral by design.","properties":{"instance_max_serves":{"description":"A composed instance is deleted after N serves, whichever comes first with TTL.","minimum":1,"type":"integer"},"instance_ttl_min":{"description":"Time-to-live of a composed personalized instance. After TTL it is deleted.","minimum":1,"type":"integer"},"media_retention":{"description":"The log keeps hashes, never media. The composed pixels never leave the device and are not stored past TTL.","enum":["hash_only"]}},"required":["instance_ttl_min","instance_max_serves","media_retention"],"type":"object"},"consent":{"additionalProperties":false,"description":"Two-axis consent contract. Axis 1 (temporal): how long. Axis 2 (target): whom it covers. Both must be satisfied for a personalized serve.","properties":{"classes_required":{"description":"Which consent classes this template needs. profile_token = name/city (text layer). likeness_binding = character-ref composition. Separate switches, never one.","items":{"enum":["profile_token","likeness_binding"]},"minItems":1,"type":"array"},"default_target":{"enum":["global","advertiser","campaign"]},"default_temporal":{"enum":["single_request","campaign_window","standing"]},"targets":{"description":"Which consent targets this template accepts. global = user allowed this sponsor everywhere; advertiser = this sponsor; campaign = this campaign only.","items":{"enum":["global","advertiser","campaign"]},"minItems":1,"type":"array"},"temporal_scopes":{"description":"single_request = one serve, then ask again.","items":{"enum":["single_request","campaign_window","standing"]},"minItems":1,"type":"array"}},"required":["temporal_scopes","default_temporal","targets","default_target","classes_required"],"type":"object"},"creative":{"additionalProperties":false,"properties":{"duration_sec":{"description":"Max on-screen time. The consent request shows this number to the user.","exclusiveMinimum":0,"maximum":60,"type":"number"},"sha256":{"description":"Content-addressed creative. The composer must verify the hash before composing.","pattern":"^[0-9a-f]{64}$","type":"string"},"type":{"description":"trailer uses the same slot mechanism as ad; only the creative type differs.","enum":["video","image","trailer"]},"uri":{"minLength":1,"type":"string"}},"required":["type","uri","sha256","duration_sec"],"type":"object"},"disclosure":{"additionalProperties":false,"description":"Runtime ad labeling. Always rendered by the runtime, never optional.","properties":{"label_text":{"description":"E.g. 'Реклама · с вашим персонажем'.","minLength":1,"type":"string"},"placement":{"enum":["corner","bottom_bar"]},"synthetic_media_flag":{"default":true,"description":"Marks AI-composited personalization for platform synthetic-media policies.","type":"boolean"}},"required":["label_text","placement"],"type":"object"},"fallback":{"additionalProperties":false,"description":"INVARIANT P1: no fallback in the pack -> validator rejects, pack is not accepted. What renders when consent is denied, revoked, expired, or no character pack is available.","properties":{"sha256":{"pattern":"^[0-9a-f]{64}$","type":"string"},"type":{"enum":["video","image","trailer"]},"uri":{"minLength":1,"type":"string"}},"required":["type","uri","sha256"],"type":"object"},"manifest_sha256":{"description":"sha256 of the canonical JSON of this manifest, excluding this field. Content-addresses the contract itself.","pattern":"^[0-9a-f]{64}$","type":"string"},"personalization_level":{"description":"Max personalization level this template uses. 1 = text tokens only (profile_token). 2 = character composition (likeness_binding). Quick filter for rollout and policy.","enum":[1,2],"type":"integer"},"slots":{"description":"Personalization slots: the ONLY places where the user's character or profile tokens may appear. Anything not declared here is forbidden.","items":{"additionalProperties":false,"properties":{"binding_rules":{"additionalProperties":false,"description":"Character-consistency guardrails: the character must stay itself.","properties":{"allow_morph":{"type":"boolean"},"allow_recolor":{"type":"boolean"},"forbidden":{"description":"Explicit bans, e.g. ['face_stretch', 'crop_below_eyes', 'voice_clone'].","items":{"type":"string"},"type":"array"},"keep_aspect_ratio":{"type":"boolean"},"max_scale":{"description":"Upper bound on upscaling the character asset inside the slot.","maximum":2.0,"minimum":1.0,"type":"number"}},"required":["keep_aspect_ratio","max_scale","allow_recolor","allow_morph"],"type":"object"},"character_role":{"description":"Role the user's character plays in this slot.","enum":["hero","cameo","host"]},"kind":{"description":"character_anchor = user's character composited into the frame (on-device). name_token/text_token = text-layer personalization, level 1.","enum":["character_anchor","name_token","text_token"]},"placement_mode":{"description":"XR placement of the slot. head_locked = glued to view; world_locked = anchored in space. Declared, not guessed.","enum":["head_locked","world_locked"]},"region":{"additionalProperties":false,"description":"Normalized 0..1 frame region for character_anchor slots.","properties":{"h":{"maximum":1,"minimum":0,"type":"number"},"w":{"maximum":1,"minimum":0,"type":"number"},"x":{"maximum":1,"minimum":0,"type":"number"},"y":{"maximum":1,"minimum":0,"type":"number"}},"type":"object"},"slot_id":{"pattern":"^[a-z0-9_]{1,32}$","type":"string"},"timeline":{"additionalProperties":false,"properties":{"end_ms":{"minimum":1,"type":"integer"},"start_ms":{"minimum":0,"type":"integer"}},"required":["start_ms","end_ms"],"type":"object"}},"required":["slot_id","kind","character_role","timeline","placement_mode","binding_rules"],"type":"object"},"minItems":1,"type":"array"},"spec_version":{"const":"1.1.0"},"sponsor_id":{"description":"Advertiser identifier in the ad network.","minLength":1,"type":"string"},"template_id":{"pattern":"^tpl_[a-z0-9_]{1,64}$","type":"string"},"template_version":{"pattern":"^\\d+\\.\\d+\\.\\d+$","type":"string"},"verification":{"additionalProperties":false,"description":"Definition of a verified impression. Mirrors xr-event.schema.json thresholds.","properties":{"billable_event":{"description":"Only ImpressionValidated WITH evidence counts. No evidence, no billing (I3).","enum":["ImpressionValidated"]},"dismiss_counts_as":{"description":"Swipe-dismiss (GestureInteraction/close) ends the session: no billable impression.","enum":["not_billable"]},"min_coverage_pct":{"description":"Minimum timeline_coverage_pct for the impression to bill.","maximum":100,"minimum":0,"type":"number"},"min_dwell_ms":{"description":"Floor matches xr-event.schema.json: 1200 ms billable attention threshold.","minimum":1200,"type":"integer"}},"required":["billable_event","min_dwell_ms","min_coverage_pct"],"type":"object"}},"required":["spec_version","template_id","template_version","manifest_sha256","sponsor_id","personalization_level","campaign","creative","slots","fallback","disclosure","verification","consent","compose","age_gate"],"title":"Ad Template Pack v1.1 — advertiser template with personalization slots (DRAFT)","type":"object"}